{
  "schema_version": 1,
  "backend": "chrome-worker-snarkjs",
  "host": {
    "recorded_at": "2026-08-09T21:03:47.832Z",
    "platform": "darwin",
    "arch": "arm64",
    "node": "v26.5.0",
    "cpus": 8,
    "cpu_model": "Apple M3",
    "total_memory_bytes": 17179869184,
    "os_release": "25.5.0",
    "device_label": "apple-m3-16gb",
    "simulated_network_mbps": 10
  },
  "results": {
    "wallet_create": {
      "artifacts": {
        "wasm": {
          "bytes": 2432468,
          "sha256": "434ee7bcffd8161e118999fc5e88b2ba369993533fc0524fecb75eb4a160fd3f"
        },
        "zkey": {
          "bytes": 1511077,
          "sha256": "64088e70403cb394b0d8c5207a99f7eaa47902dd818eb335607750907439b3ec"
        },
        "verification_key": {
          "bytes": 2925,
          "sha256": "145a3f75078558435c4b7ab209fe0aa7f169b1759db838364242535844d7d048"
        }
      },
      "warmups": 0,
      "browser": {
        "user_agent": "Mozilla/5.0 (Macintosh; Intel Mac OS X 10_15_7) AppleWebKit/537.36 (KHTML, like Gecko) HeadlessChrome/150.0.0.0 Safari/537.36",
        "hardware_concurrency": 8,
        "device_memory_gib": 16,
        "cross_origin_isolated": true,
        "prover_threads": 1,
        "measured_memory_bytes_at_boot": 622928,
        "measured_memory_source_at_boot": "performance.memory.usedJSHeapSize",
        "measured_memory_bytes_after": 645374,
        "measured_memory_source_after": "performance.memory.usedJSHeapSize",
        "max_main_thread_stall_ms": 1.0600000023841858,
        "process_tree_rss": {
          "sample_count": 5,
          "peak_rss_bytes": 1029750784,
          "first_quartile_median_rss_bytes": 1720320,
          "last_quartile_median_rss_bytes": 1026605056,
          "growth_bytes": 1024884736
        },
        "soak_process_tree_rss": null,
        "process_tree_rss_samples": [
          {
            "elapsed_ms": 12.14,
            "rss_bytes": 1720320,
            "phase": "setup"
          },
          {
            "elapsed_ms": 1052.35,
            "rss_bytes": 994902016,
            "phase": "setup"
          },
          {
            "elapsed_ms": 2088.81,
            "rss_bytes": 995491840,
            "phase": "setup"
          },
          {
            "elapsed_ms": 3118.68,
            "rss_bytes": 1029750784,
            "phase": "setup"
          },
          {
            "elapsed_ms": 4152.93,
            "rss_bytes": 1026605056,
            "phase": "setup"
          }
        ]
      },
      "cold_browser_sessions": [
        {
          "user_agent": "Mozilla/5.0 (Macintosh; Intel Mac OS X 10_15_7) AppleWebKit/537.36 (KHTML, like Gecko) HeadlessChrome/150.0.0.0 Safari/537.36",
          "hardware_concurrency": 8,
          "device_memory_gib": 16,
          "cross_origin_isolated": true,
          "prover_threads": 1,
          "measured_memory_bytes_at_boot": null,
          "measured_memory_source_at_boot": null,
          "measured_memory_bytes_after": null,
          "measured_memory_source_after": null,
          "max_main_thread_stall_ms": 1.1649999991059303,
          "process_tree_rss": {
            "sample_count": 4,
            "peak_rss_bytes": 1029931008,
            "first_quartile_median_rss_bytes": 1687552,
            "last_quartile_median_rss_bytes": 1029931008,
            "growth_bytes": 1028243456
          },
          "soak_process_tree_rss": null,
          "process_tree_rss_samples": [
            {
              "elapsed_ms": 11.9,
              "rss_bytes": 1687552,
              "phase": "setup"
            },
            {
              "elapsed_ms": 1039.99,
              "rss_bytes": 1015218176,
              "phase": "setup"
            },
            {
              "elapsed_ms": 2076.99,
              "rss_bytes": 1015840768,
              "phase": "setup"
            },
            {
              "elapsed_ms": 3113.77,
              "rss_bytes": 1029931008,
              "phase": "setup"
            }
          ]
        },
        {
          "user_agent": "Mozilla/5.0 (Macintosh; Intel Mac OS X 10_15_7) AppleWebKit/537.36 (KHTML, like Gecko) HeadlessChrome/150.0.0.0 Safari/537.36",
          "hardware_concurrency": 8,
          "device_memory_gib": 16,
          "cross_origin_isolated": true,
          "prover_threads": 1,
          "measured_memory_bytes_at_boot": null,
          "measured_memory_source_at_boot": null,
          "measured_memory_bytes_after": null,
          "measured_memory_source_after": null,
          "max_main_thread_stall_ms": 1.5,
          "process_tree_rss": {
            "sample_count": 4,
            "peak_rss_bytes": 1029931008,
            "first_quartile_median_rss_bytes": 1703936,
            "last_quartile_median_rss_bytes": 1029931008,
            "growth_bytes": 1028227072
          },
          "soak_process_tree_rss": null,
          "process_tree_rss_samples": [
            {
              "elapsed_ms": 11.62,
              "rss_bytes": 1703936,
              "phase": "setup"
            },
            {
              "elapsed_ms": 1048.5,
              "rss_bytes": 1015250944,
              "phase": "setup"
            },
            {
              "elapsed_ms": 2079.06,
              "rss_bytes": 1015857152,
              "phase": "setup"
            },
            {
              "elapsed_ms": 3111.27,
              "rss_bytes": 1029931008,
              "phase": "setup"
            }
          ]
        },
        {
          "user_agent": "Mozilla/5.0 (Macintosh; Intel Mac OS X 10_15_7) AppleWebKit/537.36 (KHTML, like Gecko) HeadlessChrome/150.0.0.0 Safari/537.36",
          "hardware_concurrency": 8,
          "device_memory_gib": 16,
          "cross_origin_isolated": true,
          "prover_threads": 1,
          "measured_memory_bytes_at_boot": null,
          "measured_memory_source_at_boot": null,
          "measured_memory_bytes_after": null,
          "measured_memory_source_after": null,
          "max_main_thread_stall_ms": 1.369999997317791,
          "process_tree_rss": {
            "sample_count": 4,
            "peak_rss_bytes": 1027211264,
            "first_quartile_median_rss_bytes": 1703936,
            "last_quartile_median_rss_bytes": 1027211264,
            "growth_bytes": 1025507328
          },
          "soak_process_tree_rss": null,
          "process_tree_rss_samples": [
            {
              "elapsed_ms": 11.95,
              "rss_bytes": 1703936,
              "phase": "setup"
            },
            {
              "elapsed_ms": 1046.01,
              "rss_bytes": 1012137984,
              "phase": "setup"
            },
            {
              "elapsed_ms": 2070.48,
              "rss_bytes": 1013497856,
              "phase": "setup"
            },
            {
              "elapsed_ms": 3104.91,
              "rss_bytes": 1027211264,
              "phase": "setup"
            }
          ]
        },
        {
          "user_agent": "Mozilla/5.0 (Macintosh; Intel Mac OS X 10_15_7) AppleWebKit/537.36 (KHTML, like Gecko) HeadlessChrome/150.0.0.0 Safari/537.36",
          "hardware_concurrency": 8,
          "device_memory_gib": 16,
          "cross_origin_isolated": true,
          "prover_threads": 1,
          "measured_memory_bytes_at_boot": null,
          "measured_memory_source_at_boot": null,
          "measured_memory_bytes_after": null,
          "measured_memory_source_after": null,
          "max_main_thread_stall_ms": 1.1749999970197678,
          "process_tree_rss": {
            "sample_count": 4,
            "peak_rss_bytes": 1028390912,
            "first_quartile_median_rss_bytes": 1703936,
            "last_quartile_median_rss_bytes": 1028390912,
            "growth_bytes": 1026686976
          },
          "soak_process_tree_rss": null,
          "process_tree_rss_samples": [
            {
              "elapsed_ms": 11.84,
              "rss_bytes": 1703936,
              "phase": "setup"
            },
            {
              "elapsed_ms": 1044.48,
              "rss_bytes": 1013760000,
              "phase": "setup"
            },
            {
              "elapsed_ms": 2074.01,
              "rss_bytes": 1014300672,
              "phase": "setup"
            },
            {
              "elapsed_ms": 3103.48,
              "rss_bytes": 1028390912,
              "phase": "setup"
            }
          ]
        },
        {
          "user_agent": "Mozilla/5.0 (Macintosh; Intel Mac OS X 10_15_7) AppleWebKit/537.36 (KHTML, like Gecko) HeadlessChrome/150.0.0.0 Safari/537.36",
          "hardware_concurrency": 8,
          "device_memory_gib": 16,
          "cross_origin_isolated": true,
          "prover_threads": 1,
          "measured_memory_bytes_at_boot": null,
          "measured_memory_source_at_boot": null,
          "measured_memory_bytes_after": null,
          "measured_memory_source_after": null,
          "max_main_thread_stall_ms": 1.2699999958276749,
          "process_tree_rss": {
            "sample_count": 4,
            "peak_rss_bytes": 1029652480,
            "first_quartile_median_rss_bytes": 1703936,
            "last_quartile_median_rss_bytes": 1029652480,
            "growth_bytes": 1027948544
          },
          "soak_process_tree_rss": null,
          "process_tree_rss_samples": [
            {
              "elapsed_ms": 11.49,
              "rss_bytes": 1703936,
              "phase": "setup"
            },
            {
              "elapsed_ms": 1040.57,
              "rss_bytes": 1014038528,
              "phase": "setup"
            },
            {
              "elapsed_ms": 2074.49,
              "rss_bytes": 1015414784,
              "phase": "setup"
            },
            {
              "elapsed_ms": 3109.92,
              "rss_bytes": 1029652480,
              "phase": "setup"
            }
          ]
        },
        {